Emotion,Description,Source
Abhiman,"A complex emotion combining hurt pride, disappointment, and self-respect, often arising from perceived neglect or lack of recognition by someone valued.",The Book of Human Emotions
Reverence,"The text conveys reverence for the ancient Sanskrit Vedas, highlighting their spiritual significance in Hinduism and their historical value in offering insights into life in India 3,500 years ago.",The Book of Human Emotions
Abhiman,"Abhiman, rooted in the Vedas, signifies ""self-pride"" intertwined with strength (balam). It is a deeply cultural and untranslatable emotion, widely recognized across the Indian subcontinent.",The Book of Human Emotions
Abhiman,"A mix of pain, anger, and wounded pride arising from betrayal by loved ones or those we expect kindness from. Rooted in sorrow and shock, it reflects a serious breach of love and respect, often seen as an inevitable and acceptable emotional response in Indian culture.",The Book of Human Emotions
Abhiman,"A stubborn emotion tied to pride, abhiman causes deep suffering, often for the one experiencing it. In Tagore's ""Shasti,"" Chandara feels betrayed and wounded when her husband falsely accuses her of murder, violating their love and her role as a wife.",The Book of Human Emotions
Resentment,"Chandara, driven by unrelenting resentment and wounded pride (abhiman), confesses to murder and rejects her repentant husband’s attempts at reconciliation, maintaining her defiance even as she faces execution.",The Book of Human Emotions
Humiliation,"A feeling of deep embarrassment, shame, or loss of dignity, often caused by being belittled or disrespected by others.",The Book of Human Emotions
Acedia,"A state of spiritual or mental sloth, marked by apathy, listlessness, and a lack of motivation, often tied to feelings of despair or disconnection.",The Book of Human Emotions
Boredom,"A creeping, distracting feeling akin to a gnat's tickle, experienced by a Christian hermit in isolation, symbolizing the spiritual danger of acedia—a sinful passion requiring resistance.",The Book of Human Emotions
Acedia,"Acedia is a historical emotion marked by a mid-day crisis involving listlessness, irritability, and escalating into desolation and despair.",The Book of Human Emotions
Acedia,"Acedia, described as a ""foul darkness,"" caused physical lethargy, despair, and restlessness among early monks. It led to conflict, regret, and even suicidal tendencies, threatening their ascetic lifestyle. Considered the most dangerous of the Eight Evil Thoughts, it undermined their spiritual devotion and communal harmony.",The Book of Human Emotions
Acedia,"Acedia is a transient state of malaise or spiritual lethargy, historically attributed to demonic influence by the Desert Mothers and Fathers, often linked to isolation, extreme penitence, and the oppressive heat of the desert, rather than a modern understanding of depression or chemical imbalance.",The Book of Human Emotions
Acedia,"Acedia, once a mortal sin, evolved into melancholia and sloth, reflecting states like depression, anxiety, and apathy. It signifies listlessness or inertia, akin to a rainy Sunday mood, and diminished as religious life shifted to less austere settings.",The Book of Human Emotions
Unclear,"The text does not provide a specific emotion but references the effects of weather on emotions, suggesting a potential exploration of mood influences.",The Book of Human Emotions
Boredom,"A state of disinterest or lack of engagement, often arising from monotony or an absence of stimulating activity.",The Book of Human Emotions
Amae,"A Japanese term describing a sense of indulgent dependency, often experienced in close relationships, where one feels safe to rely on another's care and affection without fear of rejection.",The Book of Human Emotions
Amae,"A desire to surrender and seek comfort and safety in the arms of a loved one, characterized by a feeling of being coddled and revived.",The Book of Human Emotions
Amae,"Amae is a Japanese concept describing dependence on others' goodwill, often seen in relationships. It can imply childlike reliance or being overly trusting, as in expecting help or success without effort. It spans family, friendships, and workplaces, with interpretations like ""spoiled behavior"" or ""leaning on others.""",The Book of Human Emotions
Amae,"Amae is an emotion of taking another’s love for granted, relying on their help without obligation for gratitude. Rooted in unconditional nurturing, it fosters trust, stable relationships, and self-compassion, reflecting a return to the indulgence of infancy.",The Book of Human Emotions
Amae,"Amae is a Japanese emotion combining vulnerability and belonging, linked to group dependency in collectivist culture. In the 1970s, Western anthropologists viewed it as evidence of how societal structures shape emotions, though claims about it defining Japanese national character are now seen as oversimplified.",The Book of Human Emotions
Amae,"Amae refers to the comfort and pleasure of relying on others' support, contrasted with English speakers' discomfort due to fears of appearing needy, creating obligations, or admitting vulnerability.",The Book of Human Emotions
Comfort,"A state of ease and reassurance, often linked to feelings of safety and emotional support.",The Book of Human Emotions
Ambiguphobia,"Fear or discomfort caused by ambiguity or uncertainty, leading to anxiety or avoidance when faced with unclear situations or outcomes.",The Book of Human Emotions
Ambiguphobia,"The discomfort or unease caused by leaving things open to interpretation, as coined by novelist David Foster Wallace.",The Book of Human Emotions
Paranoia,"A state of intense distrust or suspicion, often involving irrational beliefs that others are out to harm or deceive.",The Book of Human Emotions
Anger,"A strong feeling of displeasure, frustration, or hostility often triggered by perceived wrongs, injustices, or obstacles.",The Book of Human Emotions
Anger,"Anger is described as a frenzied, destructive emotion likened to insanity, often triggered by feeling insulted or demeaned. Seneca viewed it as disruptive in civilized settings, advocating for restraint and rational reflection to prevent regretful outbursts.",The Book of Human Emotions
Anger,"Anger is a complex emotion ranging from resentment to violent rage. It can harm relationships and careers but also drive political action and productivity. Its expression is debated, with some advocating for open confrontation and others internalizing it, as illustrated in Woody Allen's *Manhattan*.",The Book of Human Emotions
Anger,"Historically, anger was seen as beneficial by some medieval and early modern doctors. It was believed to revive vitality, cure ailments like paralysis, and even slow aging by warming the body. Physicians like Ibn Butlan and Roger Bacon advocated its health benefits, contrasting modern views of anger as harmful.",The Book of Human Emotions
Anger,"In mid-20th century therapy, anger was seen as a path to healing. Techniques like ventilation therapy and Primal Scream Therapy encouraged expressing rage to access authentic identity, break down false selves, and address repressed emotions linked to addiction or mental distress. This approach sometimes successfully reconnected patients to their true selves.",The Book of Human Emotions
Anger,"Anger often arises from criticism or unfair treatment and can motivate effort or provide temporary relief by masking deeper emotions like fear or guilt. It may serve as a coping mechanism, releasing tension or shifting blame, though it can sometimes act as a decoy for more painful feelings.",The Book of Human Emotions
Anger,"Anger, whether intense or subdued, is examined as a means of suppressing other emotions, shifting the focus from its health benefits to its role in emotional regulation.",The Book of Human Emotions
Resentment,A feeling of bitterness or anger that arises when emotions or grievances are suppressed and not expressed.,The Book of Human Emotions
Anticipation,A feeling of excitement or nervousness about something that is expected to happen in the future.,The Book of Human Emotions
Anticipation,Grandma expresses a sense of expectation and confidence about something yet to happen.,The Book of Human Emotions
Anticipation,"The writer expresses a deep love for the moment when the lights dim and the curtain glows, filled with pure anticipation of something wonderful, regardless of the outcome.",The Book of Human Emotions
Anticipation,The text conveys a preference for the excitement and hopefulness of the journey or buildup over the final outcome or destination.,The Book of Human Emotions
Uncertainty,"A brief expression of doubt or hesitation, suggesting a lack of confidence or assurance.",The Book of Human Emotions
Nostalgia,"A bittersweet longing for the past, reflecting on memories with a mix of affection and melancholy.",The Book of Human Emotions
Anticipation,"A feeling of eager expectation, described as prematurely indulging in future pleasures, akin to recklessly spending delights not yet realized.",The Book of Human Emotions
Anticipation,"Anticipation historically referred to spending money before earning it, tied to economic practices like dowries or wage advances, reflecting its roots in economics and exchange rather than natural phenomena.",The Book of Human Emotions
Anticipation,"The text explores the intense and vivid experience of anticipation, highlighting both the excitement and the risk of disappointment when looking forward to an event or outcome.",The Book of Human Emotions
Anticipation,The speaker expresses a sense of expectation or confidence about something that will happen in the future.,The Book of Human Emotions
Gratitude,"A feeling of thankfulness and appreciation, often tied to recognizing the positive aspects of life or the benefits received from others.",The Book of Human Emotions
Curiosity and Hopefulness,"A blend of inquisitiveness and optimism, reflecting a desire to explore and a belief in positive outcomes.",The Book of Human Emotions
Anxiety,"A feeling of unease, worry, or nervousness, often about an imminent event or uncertain outcome.",The Book of Human Emotions
Anxiety,A feeling of unease or distress arising from the overwhelming possibilities and uncertainties associated with freedom.,The Book of Human Emotions
Anxiety,"A profound sense of unease or dread stemming from the awareness of freedom and the responsibility of choice, as explored philosophically by Søren Kierkegaard.",The Book of Human Emotions
Anxiety,"A constricting, restless emotion marked by physical symptoms like a lurching stomach and tight throat, coupled with a mind overwhelmed by endless, often undefined worries. It amplifies ordinary troubles into catastrophic visions, leaving one fidgety, breathless, and inhibited, rooted in the Greek meaning of being pressed or weighed down.",The Book of Human Emotions
Anxiety,"Anxiety is a common experience often viewed as undesirable and counterproductive, associated with worst-case thinking and physical symptoms. It is portrayed as incompatible with success or happiness, leading to widespread efforts, including medications and therapies, to alleviate it and promote mental freedom.",The Book of Human Emotions
Anxiety,"Anxiety, seen as a curse today, was historically viewed by some philosophers as an enriching response to confronting personal freedom, only becoming regarded as an affliction in the past century.",The Book of Human Emotions
Anxiety,"Anxiety, termed ""Angstneurose"" by Freud, is characterized by ""anxious expectation"" or fearing the worst, with symptoms like heart palpitations and night terrors. Freud linked it to sexual frustration, suggesting unfulfilled libido manifested in physical symptoms, viewing anxiety as a distorted form of genuine desire.",The Book of Human Emotions
Anxiety,"Anxiety, termed the ""Age of Anxiety"" in the 1940s, became a defining psychiatric condition of the 20th century, fueled by societal stress, pharmaceutical advances, and gendered diagnostic trends. It has resurged as the most diagnosed disorder in the U.S., with expanded classifications and a higher prevalence among women.",The Book of Human Emotions
Angst,"Kierkegaard's concept of angst combines anguish about the present and dread about the future, arising from the realization of absolute freedom and responsibility in life. He viewed it as a hallmark of authentic existence, urging individuals to acknowledge and understand its significance rather than avoid or be paralyzed by it.",The Book of Human Emotions
Anxiety,"Anxiety is portrayed as a misunderstood emotion, often seen as something to escape, rather than a sign of personal freedom and autonomy.",The Book of Human Emotions
Reverence,"The feeling is regarded as significant and profound, not to be trivialized or dismissed as a simple ailment.",The Book of Human Emotions
Anxiety,"A state of unease often linked to uncertainty, worry, or nervousness, sometimes referred to as ""collywobbles.""",The Book of Human Emotions
Apathy,"A lack of interest, enthusiasm, or concern, often resulting in emotional detachment or indifference toward situations, people, or activities.",The Book of Human Emotions
Apathy,"A state of indifferent detachment, characterized by a lack of concern or motivation, often seen as a response to stress or dejection. Unlike boredom, apathy embraces inactivity and indolence, offering a sense of calm or even pleasure in doing nothing.",The Book of Human Emotions
Apatheia,"Apatheia, central to Stoic philosophy, refers to the restraint of disruptive emotions like anger and jealousy to act justly and rationally. It involves interrupting emotional responses at their initial stirrings, fostering a state of love without destructive passions for societal harmony.",The Book of Human Emotions
Apathy,"Apathy is viewed with suspicion due to its association with indifference, highlighted by the infamous murder of Kitty Genovese, which challenges the idea of maintaining life in a detached, emotionless equilibrium.",The Book of Human Emotions
Apathy,"The residents displayed apathy, as their instincts for alarm or compassion were suppressed, assuming others would help instead. This contrasts with theories of mob behavior, suggesting a lack of action rather than impulsive, irrational responses in a crowd.",The Book of Human Emotions
Apathy,"Apathy is a state of indifference, marked by a loss of motivation or purpose, often linked to feeling overwhelmed or defeated. It can lead to paralysis and antisocial behavior, arising not just from individual psychology but also from group dynamics, as seen in the ""bystander effect.""",The Book of Human Emotions
Skepticism,"The text conveys skepticism about the accuracy of initial reports regarding the Genovese case, questioning why the exaggerated figure of thirty-eight witnesses was so readily believed by both the public and psychologists.",The Book of Human Emotions
Apathy,"Apathy is viewed with ambivalence—welcomed for its detachment from emotional strife yet feared for its lack of motivation, leading to inaction in societal responsibilities. This duality creates nervousness and indecision, leaving individuals overwhelmed and disengaged.",The Book of Human Emotions
Bafflement,"A state of confusion or puzzlement, often accompanied by an inability to understand or make sense of a situation.",The Book of Human Emotions
L'appel du vide,"A sudden, inexplicable urge to jump from high places or engage in self-destructive actions, despite no actual desire to harm oneself.",The Book of Human Emotions
Temptation mixed with fear,"A gripping, horrifying compulsion to jump or act on self-destructive urges, often mistaken for fear of heights, as depicted in Hitchcock’s *Vertigo*, where the allure of the vanishing point paralyzes the character with the fear of surrendering to the temptation.",The Book of Human Emotions
L’appel du vide,"A disquieting impulse where one feels the urge to act on dangerous thoughts, creating fear and instability by highlighting the fragility of self-control and the potential for emotions to lead to irrational actions.",The Book of Human Emotions
Terror,A profound and overwhelming fear often linked to a sense of imminent danger or dread.,The Book of Human Emotions
Awumbuk,"A feeling of emptiness or sadness experienced after guests leave, stemming from the void left by their departure.",The Book of Human Emotions
Apathy,"A sense of emptiness and detachment after visitors leave, where relief is mixed with a foggy, muffled feeling, making everything seem pointless.",The Book of Human Emotions
Awumbuk,"A feeling of distraction and inertia experienced by the Baining people after guests depart, attributed to a lingering oppressive mist. This state disrupts daily life until a cleansing ritual restores normalcy.",The Book of Human Emotions
Melancholy/Grief,"A deep emotional state characterized by sadness, sorrow, or reflective longing, often tied to loss or introspection.",The Book of Human Emotions
Bafflement,"A state of confusion or puzzlement, often caused by something unexpected or difficult to understand.",The Book of Human Emotions
Curiosity,"The text evokes curiosity by exploring the inventive and clever nature of ""bafflers"" (now ""baffles""), their historical roots, and their modern use in manipulating sound waves to dampen noise.",The Book of Human Emotions
Bafflement,"Bafflement arises from overwhelming uncertainty and disorder, making it hard to decide or proceed. It can lead to frustration, impatience, disgust, exhaustion, and even existential angst due to an overload of information and a sense of purposelessness.",The Book of Human Emotions
Bewilderment,"A state of confusion or puzzlement, often caused by something unexpected or difficult to understand.",The Book of Human Emotions
Basorexia,"An intense, overwhelming desire to kiss someone.",The Book of Human Emotions
Desire,A spontaneous and intense longing to express affection or attraction through a kiss.,The Book of Human Emotions
Vulnerability,"A state of being open to emotional exposure, uncertainty, or risk, often involving sensitivity to external influences or potential harm.",The Book of Human Emotions
Befuddlement,"A state of confusion or perplexity, often caused by unclear or complex situations, leaving one mentally disoriented or unable to think clearly.",The Book of Human Emotions
Nebuchaos,"A feeling of disarray or unease triggered by obscure words or incomplete lists, reflecting a struggle with ambiguity or lack of clarity.",The Book of Human Emotions
Bafflement,"A state of confusion or puzzlement, often arising from something unexpected or difficult to understand.",The Book of Human Emotions
Bewilderment,"A state of confusion or puzzlement, often caused by something unexpected or difficult to understand.",The Book of Human Emotions
Industriousness,"A focused and efficient mindset driven by principles of tidiness, planning, and organization.",The Book of Human Emotions
Overwhelm,"Feeling pressured and constrained in a success-driven world, with little tolerance for confusion or disorder.",The Book of Human Emotions
Confusion,"The text explores confusion as central to therapy, where patients seek clarity and organization to address destructive patterns or cravings. Disorganization is portrayed as a subconscious, self-defeating behavior that hinders personal progress and success.",The Book of Human Emotions
Curiosity,"Curiosity arises from exploring mess and chaos, which can lead to unexpected discoveries, connections, and insights. This deliberate, subconscious creation of disorder in relationships or work reflects a desire to uncover something new and meaningful.",The Book of Human Emotions
Confusion,"King Lear experiences profound confusion, feeling rejected by his children and lost in the wilderness. This disorientation drives a feverish self-reinvention, encapsulated in his existential question, “Who is it that can tell me who I am?”",The Book of Human Emotions
Frustration with confusion,"The feeling of being overwhelmed by disorder and noise, yet recognizing the value in confronting confusion to find clarity and meaningful insights.",The Book of Human Emotions
Hopefulness,"The text conveys a sense of hopefulness, emphasizing the idea that setbacks or losses can lead to unexpected and potentially better opportunities.",The Book of Human Emotions
Overwhelmed,"A state of being emotionally or mentally burdened, often due to excessive stimuli or demands, leading to difficulty in coping or processing.",The Book of Human Emotions
Boredom,"A state of disinterest or lack of engagement, often arising from monotony, repetition, or insufficient stimulation.",The Book of Human Emotions
Boredom,"A restless state of feeling trapped, inert, and disinterested, paired with a vague desire for change without knowing what would satisfy it.",The Book of Human Emotions
Boredom,"Boredom, as understood today, emerged in the Victorian era but has historical roots. It combines weariness and disgust, often arising from repetitive or uninteresting experiences, such as dull company or incomprehensible lectures, akin to the medieval concept of ""acedia.""",The Book of Human Emotions
Boredom,"Boredom emerged in 1853 as a response to changing perceptions of time during industrialization. The division between work and leisure led to middle-class pursuits of self-improvement and entertainment, fostering industries like tourism and recreation to address the desire for diversion and novelty.",The Book of Human Emotions
Boredom,"Boredom, seen as a mark of inadequacy, was linked to health issues and social ills. It was criticized by doctors, politicians, and feminists for its corrosive effects, particularly on women. Literature, like Dickens’s *Bleak House*, depicted it as a chronic malady of modern life with harmful consequences.",The Book of Human Emotions
Boredom,"Boredom persists despite modern stimulation and flexible work-life integration. It’s reframed in contemporary terms, linked to ADHD and low dopamine levels, causing restlessness and distraction. High boredom proneness correlates with risks like substance abuse, obesity, and errors in tasks like driving.",The Book of Human Emotions
Boredom,"Boredom, often seen negatively, can lead to creative thinking and motivation for change. While it may start as dissatisfaction or listlessness, it can foster imagination and cultural advancement, as noted by creatives like Grayson Perry and Meera Syal. Over-scheduling may hinder this potential, suggesting boredom's value in personal and cultural growth.",The Book of Human Emotions
Irritation,"Refers to a state of annoyance or mild anger, often associated with feelings of apathy or being upset, as indicated by terms like ""cheesed off.""",The Book of Human Emotions
Unclear,The text does not provide sufficient context or details to determine a specific emotion.,The Book of Human Emotions
Curiosity,"A strong urge to explore or imagine potential outcomes, despite knowing it might lead to negative consequences.",The Book of Human Emotions
Brabant,"A feeling of curiosity or mischievousness, characterized by the urge to test someone's limits or see how far they can be pushed.",The Book of Human Emotions
Perversity,"A deliberate desire to behave in an unreasonable or unacceptable way, often contrary to one's own interests.",The Book of Human Emotions
Broodiness,"A contemplative and often melancholic state, marked by deep thought or preoccupation with concerns, worries, or unresolved feelings.",The Book of Human Emotions
Broodiness,A maternal longing or desire to have a(nother) baby.,The Book of Human Emotions
Undefined,The text does not provide an emotion description or context to analyze.,The Book of Human Emotions
Baby lust,"A hormone-driven, intense desire or longing for a baby, often stereotypically associated with women and triggered by sensory cues like a baby's scent.",The Book of Human Emotions
Broodiness,"A powerful emotional state combining a henlike instinct to reproduce with moodiness or brooding, emerging as a motivator for reproduction after contraception made childbearing a choice rather than an inevitability.",The Book of Human Emotions
Yearning,"A deep sense of longing and emotional pain for something missing, akin to separation from a loved one or home, accompanied by hope, worry, desire, and sadness, particularly in the context of wanting a child.",The Book of Human Emotions
Disappointment,"The text conveys disappointment in the reductive portrayal of women's emotions as controlled by biology, referencing historical misconceptions like hysteria and Plato's depiction of the womb as a source of anguish when barren.",The Book of Human Emotions
Broodiness,"Broodiness is a complex emotion linked to a desire for a child, associated with heightened sex drive, depressive states, and feelings of sorrow, guilt, isolation, and anger. While traditionally seen as a female experience, studies reveal it is also significant among men, with many reporting depression over involuntary childlessness.",The Book of Human Emotions
Broodiness,"A complex feeling tied to societal expectations of women, where the absence of a desire for parenthood may lead to self-doubt or a sense of missing a fundamental aspect of womanhood.",The Book of Human Emotions
Doubt,"The statement reflects uncertainty or disbelief, indicating a lack of conviction in the truth of either option.",The Book of Human Emotions
Torschlusspanik,"A German term describing the fear of missing out or a sense of urgency as opportunities diminish, often tied to aging or life milestones.",The Book of Human Emotions
