Emotion,Description,Source
Grief,"Grief lingers long after a funeral, marked by restlessness, uncertainty, and a sense of suspense. C. S. Lewis described it as a ""permanently provisional feeling,"" with disrupted habits and expectations, leaving one waiting for change while struggling to settle into a new normal.",The Book of Human Emotions
Grief,"A profound sorrow marked by anger, self-reproach, and haunting memories of a lost loved one. It manifests in vivid reminders, lingering expectations, and an inability to let go, as seen in Chagall's art depicting his connection to his deceased wife. Grief often resists closure, leaving one absorbed in its grip.",The Book of Human Emotions
Grief,"Grief is a complex and culturally influenced emotion, often shaped by societal norms and expectations. It can feel isolating yet follows prescribed behaviors, varying across cultures. Public mourning, as seen after Princess Diana's death, can pressure individuals to display grief visibly, highlighting its coercive and performative aspects.",The Book of Human Emotions
Grief,"Grief is often described through the five stages model—denial, anger, bargaining, depression, and acceptance—originating from Kübler-Ross’s work on terminal diagnoses. However, grief is more fluid, often circular, and can leave lasting emotional scars, as it is not something one fully overcomes but learns to live with.",The Book of Human Emotions
Sadness,"A state of emotional pain often linked to loss, disappointment, or helplessness, characterized by feelings of sorrow or unhappiness.",The Book of Human Emotions
Guilt,"A feeling of responsibility or remorse for a wrongdoing, mistake, or failure, often accompanied by a desire to make amends or correct the situation.",The Book of Human Emotions
Frustration,"Oscar feels intense frustration as his friend Felix, despite being taken in during a crisis, becomes overbearing with his obsessive habits, making life unbearable for Oscar and ultimately leading to a conflict where Oscar snaps and throws Felix out again.",The Book of Human Emotions
Resentment,"Felix expresses a sense of blame and bitterness, holding the other person responsible for his situation and implying a tense, unresolved conflict.",The Book of Human Emotions
Defiance,Oscar exhibits defiance by blocking the door and refusing to let someone leave until they retract a statement.,The Book of Human Emotions
Confusion,"Felix expresses uncertainty and lack of understanding, seeking clarification about what needs to be taken back.",The Book of Human Emotions
Frustration,"Oscar expresses frustration and disbelief, possibly due to confusion or dissatisfaction, as he questions and reacts strongly to a situation involving ""The Curse of the Cat People.""",The Book of Human Emotions
Guilt,"Felix's act of revenge causes Oscar to experience guilt, described as a pervasive and modern-day affliction.",The Book of Human Emotions
Guilt,"Guilt arises from breaking rules, leading to shame, anxiety, and a sense of confinement. It drives efforts to repair the damage, seeking absolution. Rooted in the concept of repayment, guilt compels individuals to compensate for their transgressions to alleviate the emotional burden.",The Book of Human Emotions
Guilt,"Guilt is a complex, often stagnant feeling tied to responsibility, remorse, or contrition. It can arise from unclear causes, excessive self-blame, or unwarranted fear, manifesting as a queasy sensation. It varies from misplaced guilt to survivor's guilt, reflecting struggles with moral codes and personal accountability.",The Book of Human Emotions
Guilt,"Freud experienced guilt over a patient’s lack of progress, which manifested in a dream where he shifted blame to a colleague. Upon waking, he recognized the dream as “wish fulfillment,” revealing his underlying fear that he was responsible for the patient’s condition.",The Book of Human Emotions
Guilt,"Guilt arises from the superego internalizing parental authority, creating a punishing inner voice. It manifests as a fear of imperfection, excessive need for atonement, or projecting blame onto others to avoid personal accountability, as seen in Freud's and Felix's interpersonal dynamics.",The Book of Human Emotions
Guilt,"Guilt is described as a mix of self-accusation and repentance, often leading to self-punishment and blame. It is seen as a stagnating force that inhibits productivity and personal fulfillment, diverting focus from meaningful action to obsessive atonement, as emphasized in psychotherapy and modern self-help perspectives.",The Book of Human Emotions
Relief,"Oscar experiences relief after a lighthearted, symbolic ceremony with Felix, which momentarily alleviates his guilt and fears. Despite mocking the gesture, the act provides a sense of emotional release following a night of anxiety and dread.",The Book of Human Emotions
Guilt,"A deep sense of guilt arises from unresolved situations, often complicated by fear, shame, or the inability to address the source. This leads to internal conflict, self-questioning, and a struggle to assign responsibility, further perpetuating the emotional burden.",The Book of Human Emotions
Guilt,"Guilt is addressed by recognizing shared responsibility and adjusting to its persistent presence, rather than seeking complete absolution or elimination of the feeling.",The Book of Human Emotions
Anticipation and Gratitude,"Emotions related to debts include anticipation, possibly about future outcomes, and gratitude, likely for assistance or understanding received.",The Book of Human Emotions
Remorse,"A deep regret or guilt for a wrong committed, often accompanied by a desire to make amends or undo the harm caused.",The Book of Human Emotions
Han,"A complex Korean emotion blending sadness, longing, and unresolved resentment, often tied to historical or personal suffering, yet carrying an undertone of hope or resilience.",The Book of Human Emotions
Han,"A deep, collective Korean emotion rooted in historical suffering, combining acceptance of pain with a quiet yearning for change, grim determination, and a blend of sadness and hope.",The Book of Human Emotions
Litost,A Czech term describing a state of torment caused by the sudden realization of one's own misery or inadequacy.,The Book of Human Emotions
Happiness,"A positive emotional state characterized by feelings of joy, contentment, and satisfaction, often resulting from favorable experiences or achievements.",The Book of Human Emotions
Mixed contentment and regret,"The author experiences a serene happiness while spending time with his daughter but is soon consumed by familiar worries and regret. He questions his life choices, wondering if prioritizing books over family has deprived him of a more joyful, idyllic existence.",The Book of Human Emotions
Happiness,"Happiness is elusive and self-reflective; overanalyzing it, as noted by J. S. Mill, can diminish the feeling itself.",The Book of Human Emotions
Happiness,"Happiness has become a measurable, commercialized concept tied to well-being, with tools like apps and studies linking it to longevity and success. However, the pursuit of controlling and quantifying this subjective emotion risks overlooking its deeper, fleeting nature.",The Book of Human Emotions
Happiness,"Historically tied to chance and divine grace, happiness evolved in the 18th century into a pursuit and personal ambition, symbolizing contentment, pleasure, and satisfaction. This shift reflected societal changes, including cultural ideals and even physical expressions like smiling, as happiness became seen as attainable and engineered rather than purely circumstantial.",The Book of Human Emotions
Happiness,"The text explores the pursuit of happiness through the lens of Utilitarianism, highlighting Jeremy Bentham's 1789 ""catalogue of pleasures,"" which aimed to quantify pleasure and pain for moral decision-making, emphasizing a rational, calculated approach to achieving happiness.",The Book of Human Emotions
Melancholy,"J.S. Mill experienced prolonged mental anguish and melancholy in his late teens, leading him to reject Bentham's simplistic view of happiness. He believed happiness was elusive, best achieved indirectly by focusing on other goals, rather than through direct pursuit or self-scrutiny.",The Book of Human Emotions
Anxiety and dissatisfaction,"The pressure to achieve happiness as an obligation or entitlement can lead to anxiety and dissatisfaction. Rejecting ""happiness"" in favor of ""flourishing,"" which embraces both pain and privilege, offers a more meaningful and fulfilling approach to life, emphasizing courage, compassion, and deferred gratification.",The Book of Human Emotions
Happiness,"Happiness is a fleeting, complex emotion with cultural variations. It can range from contentment to excitement, but some view it as dangerous or undesirable. Cultures like New Zealand and Ifaluk associate it with risks or negative traits, challenging its perception as a universally desirable state.",The Book of Human Emotions
Cheerfulness/Joy,"A state of happiness and positivity, often associated with lightheartedness and a sense of delight.",The Book of Human Emotions
Hatred,"Intense dislike or hostility towards someone or something, often accompanied by feelings of anger, resentment, or aversion.",The Book of Human Emotions
Claustrophobia,"A sense of entrapment and escalating tension arises in a violent, oppressive environment, where hatred fuels cycles of revenge and random cruelty, leaving individuals feeling suffocated and powerless.",The Book of Human Emotions
Hatred,"The text reflects societal hatred, emphasizing its prevalence in the 1980s and 1990s through hate crimes and violence driven by intolerance, leading to the introduction of hate-crime legislation in Western Europe.",The Book of Human Emotions
Hate,"Hate is an intense emotion often expressed in frustration or rage, but its meaning has evolved to signify a prejudiced attitude that can be legally accountable, blending emotion and mindset.",The Book of Human Emotions
Hatred,"Hatred, as defined by Aristotle, is a deep, incurable emotion directed at groups or types, aiming for their annihilation. Unlike anger, it is not painful but can evoke moral superiority, as it is often linked to perceived injustice.",The Book of Human Emotions
Hatred,"Hatred is portrayed as morally deficient and central to prejudice-driven crimes, sparking debate over its role in legal rhetoric. Critics argue its use is inflammatory and subjective, while defenders highlight its toxic emotional harm. It symbolizes societal contempt for intolerance and antisocial behavior, raising questions about its measurability and punishability.",The Book of Human Emotions
Hatred,"Hatred, as described by Hazlitt, can be a refined enjoyment that fosters camaraderie through shared disdain. It provides a sense of superiority and self-congratulation by ridiculing others, offering temporary feelings of greatness and unity in opposition to disliked individuals or ideas.",The Book of Human Emotions
Jealousy; Contempt,"References emotions like jealousy and contempt, often relevant in court contexts, suggesting their significance in legal or interpersonal disputes.",The Book of Human Emotions
Smugness,"A feeling of self-satisfaction or superiority, often accompanied by an air of conceit or complacency.",The Book of Human Emotions
Heebie-jeebies,"A feeling of intense nervousness, unease, or fear, often accompanied by physical discomfort or shivers.",The Book of Human Emotions
Apprehension,"A ghoulish and uneasy feeling, similar to jitters or willies, often described as the heebie-jeebies.",The Book of Human Emotions
Dread,"A strong feeling of fear or apprehension about something that may happen, often accompanied by a sense of impending doom or unease.",The Book of Human Emotions
Hiraeth,"A deep longing or nostalgia for a place, time, or feeling that may no longer exist or is unattainable.",The Book of Human Emotions
Hiraeth,"A deep yearning for one’s homeland, marked by love, nostalgia, and a sense of vulnerability or impending loss. Commonly felt by émigrés, it reflects a bittersweet connection to home, celebrated in Welsh culture and history.",The Book of Human Emotions
Homesickness,"A longing or deep emotional yearning for one's home or familiar surroundings, often accompanied by feelings of nostalgia and sadness.",The Book of Human Emotions
Hoarding,"The intense urge to accumulate and retain items, often driven by fear of loss, emotional attachment, or a sense of security, even when the items may have little practical value.",The Book of Human Emotions
Nostalgia,"A sentimental longing for past romantic connections, reflected in cherished mementos collected by Mercedes de Acosta from her love affairs with prominent Hollywood women of the 1920s and ’30s.",The Book of Human Emotions
Nostalgia,"A reflective longing tied to preserving mementos as evidence of love, belonging, and being loved, emphasizing the personal connection to one's past and inner life.",The Book of Human Emotions
Attachment,"A sense of reassurance and identity derived from collecting objects, reflecting permanence, achievement, and self-expression. It may involve jealousy, possessiveness, or a need for control, while also offering pleasure in the endless pursuit of connoisseurship and order.",The Book of Human Emotions
Grief,"The urge to hoard wealth, as seen in Ebenezer Scrooge, can stem from unresolved grief tied to deprivation, loss, and neglect. It reflects an attempt to compensate for emotional voids and retrieve what is irretrievably lost.",The Book of Human Emotions
Attachment,"The urge to hoard stems from a deep emotional attachment to objects, which provide comfort, meaning, and protection against loneliness or a hostile world. Even seemingly useless items can hold profound personal significance, offering emotional connection and warmth amidst adversity.",The Book of Human Emotions
Curiosity and Nostalgia,"A blend of curiosity, the desire to explore or learn, and nostalgia, a sentimental longing for the past.",The Book of Human Emotions
Homefulness,"A feeling of comfort, safety, and belonging, often associated with being at home or in a familiar, secure environment.",The Book of Human Emotions
Homefulness,"John Clare experienced ""homefulness,"" a profound sense of being restored and fulfilled by the feeling of being on the path toward home after an arduous journey escaping an asylum.",The Book of Human Emotions
Homefulness,"A sense of relief, belonging, and satisfaction experienced upon returning home after a journey or completing a task.",The Book of Human Emotions
Loneliness,"Feeling disconnected and isolated despite being in a familiar or supposed place of comfort, highlighting a profound sense of being ""homeless at home.""",The Book of Human Emotions
Nostalgia,"A longing for familiar places or experiences, often tied to homesickness or the desire to explore (wanderlust).",The Book of Human Emotions
Homesickness,"A longing for one's home or familiar environment, often accompanied by feelings of sadness, nostalgia, and discomfort when away from it.",The Book of Human Emotions
Homesickness,A deep yearning to return home and experience the comfort and familiarity of being there.,The Book of Human Emotions
Longing,"A deep yearning for home and familiarity, reflecting a profound desire to return to a place of comfort and belonging.",The Book of Human Emotions
Homesickness,"Soldiers at Camp Bastion experienced homesickness, marked by panic attacks, night terrors, dejection, and concentration lapses. This deep longing for home, similar to that of children, was a significant emotional challenge with potentially fatal consequences in the harsh desert environment.",The Book of Human Emotions
Nostalgia,"Nostalgia is a deep longing for home, historically linked to debilitating effects on soldiers. From Odysseus' tears to Swiss mercenaries' fatal homesickness and Civil War diagnoses, it caused illness, desertion, and even death, with the only cure being a return home.",The Book of Human Emotions
Homesickness,"Homesickness, though no longer a medical discharge reason, remains impactful in military life. Prolonged distance from home can lead to depression and anxiety, mitigated by camaraderie, communication, and familiar comforts like food or technology, which provide brief moments of ""homefulness"" to ease the longing for loved ones.",The Book of Human Emotions
Homesickness,"Homesickness, often stigmatized as weakness, is linked to isolation and depression-like symptoms. Its status declined in the 20th century as travel expanded and wanderlust was celebrated, making the inability to enjoy being away from home seem like a personal failing.",The Book of Human Emotions
Homesickness,"A deep longing for one's home, often marked by sorrow and estrangement. It can manifest as a conflicted feeling of yearning for familiar comforts while simultaneously dreading the idea of returning, leaving individuals feeling like permanent outsiders.",The Book of Human Emotions
Dépaysement,"A feeling of disorientation or estrangement caused by being in an unfamiliar environment, often evoking a mix of discomfort and curiosity.",The Book of Human Emotions
Hopefulness,"A feeling of optimism and expectation for positive outcomes or a better future, often accompanied by confidence and motivation.",The Book of Human Emotions
Optimism,"The text describes a coercive societal insistence on optimism, particularly in the context of illness. It critiques how the positive psychology movement equates hope and optimism with manufactured positivity, linking them to improved well-being and pressuring individuals to maintain an upbeat attitude.",The Book of Human Emotions
Fear and Anger,"Patients with cancer often feel fear and anger, which can be suppressed by societal pressure to maintain a hopeful outlook. This positivity may ease the burden on others but can alienate patients, inducing guilt and preventing them from fully expressing their true emotions.",The Book of Human Emotions
Hope,"Hope is a vulnerable yet strengthening emotion, offering relief in desperate situations while acknowledging uncertainty and lack of control. It involves a leap into the unknown, often accompanied by the risk of disappointment or regret, and cannot be fully conjured or controlled like optimism.",The Book of Human Emotions
Dread and Vulnerability,A state of intense fear or anxiety combined with a sense of exposure or susceptibility to harm.,The Book of Human Emotions
Frustration,"A state of annoyance or irritation, often expressed through audible sighs or huffs.",The Book of Human Emotions
Weather-influenced emotions,"Weather impacts emotions; muggy days feel oppressive, sunlight uplifts, and storms metaphorically express complex, hard-to-describe feelings.",The Book of Human Emotions
Huffed,"A state of petulance and irritation, often due to a perceived insult, characterized by a mix of pride and anger.",The Book of Human Emotions
Righteous fury,"A passionate and defiant anger driven by a sense of justice, as seen in Antigone’s reaction to her brother’s punishment, influenced by ancient beliefs linking winds to internal emotional turmoil.",The Book of Human Emotions
Stillness,"A sense of calm and tranquility, evoking a peaceful and unchanging state.",The Book of Human Emotions
Captivation,A profound and gripping emotional experience that deeply holds and moves her soul.,The Book of Human Emotions
Melancholy,"A feeling of deep sadness or pensive reflection, often linked metaphorically to the wind's influence.",The Book of Human Emotions
Weather-related emotions,"Refers to feelings influenced by weather, with examples like ""acedia"" (spiritual sloth or melancholy) and ""gezelligheid"" (coziness or conviviality).",The Book of Human Emotions
Humility,"A sense of modesty and lack of arrogance, often accompanied by an awareness of one's limitations or the value of others.",The Book of Human Emotions
Humiliation,"A significant emotional state involving feelings of shame, embarrassment, or loss of dignity, often caused by being demeaned or belittled.",The Book of Human Emotions
Humiliation,"A deeply painful feeling of shame or embarrassment caused by being degraded, ridiculed, or exposed to disrespect, often in a public or vulnerable context.",The Book of Human Emotions
Humility,"Abraham Lincoln declared April 30, 1863, as a day of national humility, urging Americans to reflect on their arrogance and seek penitence through prayer, fasting, and humility, viewing the Civil War as divine retribution for their pride and self-sufficiency.",The Book of Human Emotions
Humiliation,"Humiliation is an unwelcome emotion involving a sense of degradation, claustrophobia, and being trapped in a diminished position, often in front of an audience. It stems from contempt and can trigger cycles of retaliation, making it deeply impactful and potentially destructive.",The Book of Human Emotions
Humility,"Humility involves modesty, respect, and acknowledgment of one's equality with others, often through acts of penance or self-restraint. Rooted in religious practices, it reminds individuals of their mortality and interconnectedness, though achieving true humility can be challenging and may provoke resistance or anger in some.",The Book of Human Emotions
Humility,"Humility involves recognizing that personal achievements and happiness often stem from external factors like privilege, luck, and societal influences, rather than solely individual effort. It contrasts with humiliation and false modesty, emphasizing an honest acknowledgment of interconnectedness and dependence on others.",The Book of Human Emotions
Gratitude,"A feeling of thankfulness and appreciation, often directed toward others or circumstances, for kindness, benefits, or positive outcomes received.",The Book of Human Emotions
Hunger,"A physical sensation or craving caused by the body's need for food, often accompanied by discomfort or urgency to eat.",The Book of Human Emotions
Comfort-seeking,"The text explores how emotions like stress, self-defense, or feeling overlooked drive overeating, using food as a source of comfort, self-kindness, or protection against external pressures and societal demands.",The Book of Human Emotions
Abandonment,"Among the Baining people, hunger symbolizes both physical need and the fear of being abandoned, reflecting the deep social connection between food, care, and belonging in their society.",The Book of Human Emotions
Hunger,"For the Baining, birdsong symbolizes hunger, intensifying when human voices fade, and forest sounds dominate, reflecting its deep emotional resonance in their culture.",The Book of Human Emotions
Longing,"A deep sense of yearning or desire, symbolized by the bird's cry, reflecting an emotional connection or absence.",The Book of Human Emotions
Sadness,"The phrase expresses a sense of sorrow or lamentation, possibly metaphorical, with ""ambiowa"" symbolizing a source of grief or mourning.",The Book of Human Emotions
Desperation,"The speaker expresses intense despair, highlighting their suffering from hunger and someone else's emotional pain for them.",The Book of Human Emotions
Nostalgia,"Reflecting on a past event involving parents traveling to Malasait, evoking a sense of longing or reminiscence.",The Book of Human Emotions
Loneliness,A feeling of sadness or isolation due to a lack of companionship or connection with others.,The Book of Human Emotions
Hwyl,"A Welsh term describing a stirring feeling of emotional motivation, inspiration, or fervor, often linked to a sense of enthusiasm or spirit.",The Book of Human Emotions
Hwyl,"A Welsh term for exuberance or excitement, likened to the feeling of sailing on a gust of wind. It describes inspiration, enthusiasm, or elevated spirits, often in creative or social contexts.",The Book of Human Emotions
Joy,"A feeling of great happiness, delight, or pleasure, often associated with positive experiences or achievements.",The Book of Human Emotions
IJIRASHII,"A Japanese term describing the feeling of being emotionally moved by someone's admirable perseverance, innocence, or vulnerability, often evoking a sense of tender admiration.",The Book of Human Emotions
Hopefulness,"The story of ""The Little Engine That Could"" evokes hopefulness and courage, aiming to inspire optimism in children. However, adults reading it may feel a poignant emotional response, reflecting on perseverance and challenges in their own lives.",The Book of Human Emotions
Ijirashii,"A profound feeling of being touched or moved by witnessing the fortitude and resilience of those initially perceived as weak or vulnerable, often blending pathos and vicarious pride, and celebrated in Japanese culture as an appropriate emotional response.",The Book of Human Emotions
Relief,"A feeling of emotional release or comfort, often leading to tears, after a period of stress or tension.",The Book of Human Emotions
Vicarious pride,"A feeling of pride experienced on behalf of someone else's achievements or success, often associated with cultural or familial contexts like ""nakhes.""",The Book of Human Emotions
Iktsuarpok,"The anticipation and restlessness felt when waiting for someone to arrive, often leading to repeatedly checking for their arrival.",The Book of Human Emotions
Anticipation,"A restless, fidgety feeling of expectancy, marked by actions like scanning for arrivals or pausing to check for signs, as described by the Inuit term ""iktsuarpok.""",The Book of Human Emotions
Anticipation,"The restless urge to check for messages or updates reflects a longing for connection, driven by a desire for human interaction in an isolating world, rather than solely by technology.",The Book of Human Emotions
