Emotion,Description,Source
Boredom,"Boredom, as explored by Dr. Teresa Belton, is linked to creativity, with interviews suggesting it can inspire innovative thinking and artistic expression.",The Book of Human Emotions
Curiosity,"The text suggests curiosity as the driving force behind cultural advancement, emphasizing its role in human progress and intellectual exploration.",The Book of Human Emotions
Nostalgia,"Brabant evokes a deep sense of longing and affection for a place or time, often tied to personal or cultural identity.",The Book of Human Emotions
Inclination,"A strong tendency or preference toward a particular action, thought, or feeling.",The Book of Human Emotions
Broodiness,"A contemplative and introspective state often marked by deep thought, concern, or preoccupation with certain ideas or emotions.",The Book of Human Emotions
Curiosity,"The text evokes curiosity by presenting a metaphorical and enigmatic description of the womb as an animal, prompting reflection and inquiry into its meaning and implications.",The Book of Human Emotions
Desire,"A longing or wish, often studied in sociological contexts, such as the experiences of involuntarily childless men as they age.",The Book of Human Emotions
Calm,"A state of tranquility and peace, free from agitation or disturbance.",The Book of Human Emotions
Ambition,"The text reflects a visionary ambition for a ""psychocivilized society,"" inspired by Delgado's experiments and their controversial implications, as discussed in a Scientific American article.",The Book of Human Emotions
Ethical concern,"The text reflects ethical concern regarding the portrayal of Delgado's experiment by journalists, highlighting issues in scientific discourse and media representation.",The Book of Human Emotions
Carefree,"A state of being free from worries, responsibilities, or concerns, often accompanied by a sense of lightness and ease.",The Book of Human Emotions
Insouciance,"A carefree, nonchalant attitude conveyed through the rhythmic, unbothered imagery of scythe-strokes, reflecting detachment and ease.",The Book of Human Emotions
Cheerfulness,"A state of happiness and lightheartedness, often accompanied by a positive and uplifting demeanor.",The Book of Human Emotions
Emotional regulation,"Employees at Walt Disney World manage emotions to align with impression management strategies, ensuring they project positivity and maintain the desired atmosphere for guests.",The Book of Human Emotions
Cheerfulness,"Cheerfulness is explored as a socially influenced emotion, evolving historically in England and America. It reflects cultural shifts and societal expectations, emphasizing positivity and outward expressions of happiness as a social norm.",The Book of Human Emotions
Cheerfulness,A pervasive and uplifting sense of happiness and positivity.,The Book of Human Emotions
Not explicitly stated,The text does not describe an emotion but references a historical manual by the Beecher Sisters on domestic science principles.,The Book of Human Emotions
Cheerfulness,Encourages adopting a positive and lively attitude by thinking and acting in a cheerful manner to improve overall well-being.,The Book of Human Emotions
Not explicitly stated,"The text references a study on the commercialization of emotions, particularly how feelings are managed and commodified in professional contexts, but does not specify a particular emotion.",The Book of Human Emotions
Not explicitly stated,"The text does not describe an emotion but references research on the connection between facial feedback, neural activity, and emotional processing, using botulinum toxin to study frown muscle denervation.",The Book of Human Emotions
Claustrophobia,"An intense fear of confined or enclosed spaces, often causing anxiety, panic, or discomfort when feeling trapped or restricted.",The Book of Human Emotions
Fear,"The text conveys a deep fear of being buried alive and the associated horror of slow suffocation, emphasizing the dread of premature burial.",The Book of Human Emotions
Collywobbles,"A feeling of nervousness, anxiety, or unease, often accompanied by a fluttery sensation in the stomach.",The Book of Human Emotions
Connection between stomach and emotions,"The text explores the interplay between the stomach, emotions, and the mind, highlighting their interconnectedness and referencing a historical study on gastric illness and its societal implications.",The Book of Human Emotions
Melancholy,"Melancholy is associated with causing disturbing or troublesome dreams, reflecting its impact on the subconscious and mental state.",The Book of Human Emotions
Comfort,"A state of physical or emotional ease, free from stress or pain, often associated with feelings of safety, relaxation, and reassurance.",The Book of Human Emotions
Comfort,"Winnicott described transitional objects as sources of comfort and reliability, representing more than just physical presence in fostering emotional security.",The Book of Human Emotions
Anticipation,"The text conveys a sense of anticipation tied to the historical context of events leading up to the Second World War, reflecting a buildup of tension and expectation.",The Book of Human Emotions
Love,"Harry Harlow's experiment explored the nature of love by observing attachment in infant monkeys to wire ""mothers,"" highlighting the emotional bond's significance beyond basic needs.",The Book of Human Emotions
Compassion,"A deep awareness of and sympathy for the suffering of others, often accompanied by a desire to help or alleviate their pain.",The Book of Human Emotions
Compassion,"Compassion is often overlooked in lists of universal emotions, yet it is a fundamental social emotion, as explored by Martha Nussbaum in her work on its significance in human interactions.",The Book of Human Emotions
Compassion,"The text discusses the desire to alleviate the suffering of an afflicted person, reflecting a compassionate response aimed at providing relief and support.",The Book of Human Emotions
Compassion,"Compassion involves recognizing and responding to the suffering of others with a desire to help, as supported by research showing its impact on altruism and neural responses to suffering.",The Book of Human Emotions
Compersion,"A feeling of joy and happiness experienced when witnessing someone else's happiness or success, often associated with relationships and the well-being of loved ones.",The Book of Human Emotions
Uncertainty,"The text conveys a sense of hesitation or doubt, reflecting an emotional state of uncertainty or unease.",The Book of Human Emotions
Confidence,"A feeling of self-assurance arising from one's abilities, qualities, or judgment.",The Book of Human Emotions
Distrust,"The text conveys a sense of skepticism and wariness toward con artists, highlighting the manipulative nature of confidence men.",The Book of Human Emotions
Trust,"The quote emphasizes trusting intuition and letting go of overthinking, encouraging reliance on inner guidance and instinct.",The Book of Human Emotions
Confidence,"Confidence is the belief in one's abilities and potential, often linked to self-assurance and success. It can be cultivated and adjusted to achieve personal and professional goals effectively.",The Book of Human Emotions
Contempt,A feeling of disdain or superiority towards someone or something perceived as unworthy or beneath respect.,The Book of Human Emotions
Injustice,"The text conveys a sense of injustice and disbelief over an Illinois man, Clifton Williams, being jailed for yawning, highlighting the perceived disproportionate punishment and its impact.",The Book of Human Emotions
Hope,"The belief in humanity's enduring potential for goodness, emphasizing an inherent predisposition toward moral virtue despite challenges or flaws.",The Book of Human Emotions
Not applicable,The provided text does not describe an emotion but references a philosophical argument by J. L. Austin on performatives and constatives in language.,The Book of Human Emotions
Not provided,The text does not explicitly describe an emotion but references historical analysis of speech and gender dynamics in late medieval England.,The Book of Human Emotions
Empowerment,"Women felt empowered as they joined an online campaign inspired by Rebecca Solnit's article, which highlighted shared experiences and sparked collective action.",The Book of Human Emotions
Courage,"The ability to confront fear, pain, danger, or uncertainty with strength and determination, often in challenging or risky situations.",The Book of Human Emotions
Admiration,"The text conveys admiration for a person who was celebrated and immortalized by the Victorians for their heroic qualities, as discussed in John Price's work on Victorian civilian heroism.",The Book of Human Emotions
Admiration,"A sense of appreciation or marvel at the abundance, thickness, and curliness of hair, highlighting its striking and desirable qualities.",The Book of Human Emotions
Courage,"The ability to remain steadfast and resolute in the face of danger or adversity, demonstrating strength and determination.",The Book of Human Emotions
Esteem,"Admiration for individuals who endure pain with resilience and strength, reflecting moral virtue and fortitude.",The Book of Human Emotions
Curiosity,"A strong desire to learn, explore, or understand something, often driven by interest or fascination with the unknown.",The Book of Human Emotions
Curiosity,"A deep interest in exploring and understanding, highlighted by historical recognition as a driving force in early modern inquiry.",The Book of Human Emotions
Curiosity,"The text reflects a speculative curiosity, exploring the intellectual or theoretical aspects of swimming rather than its practical application.",The Book of Human Emotions
Connection,"Evolutionary psychologists propose that human emotions evolved to foster social bonds, with behaviors like grooming and gossip serving as tools for maintaining relationships, as discussed in Robin Dunbar's work.",The Book of Human Emotions
Intrusion,"The feeling of being secretly observed or eavesdropped on, evoking discomfort or violation of privacy.",The Book of Human Emotions
Delight,"A feeling of great pleasure, joy, or satisfaction often triggered by something pleasing or unexpected.",The Book of Human Emotions
Not explicitly stated,"The text does not describe an emotion but references John Locke's philosophical work, ""An Essay Concerning Humane Understanding,"" specifically book II, chapter XX, discussing ideas and understanding.",The Book of Human Emotions
Dépaysement,"A feeling of disorientation or estrangement experienced when in an unfamiliar environment, often tied to being away from one's usual surroundings or culture.",The Book of Human Emotions
Curiosity,The act of secretly observing or uncovering details about others' lives while performing routine tasks reflects a deep curiosity and desire to explore hidden aspects of human behavior.,The Book of Human Emotions
Desire,"A strong feeling of wanting or longing for something, often accompanied by a sense of anticipation or yearning to fulfill a need or wish.",The Book of Human Emotions
Despair,"A profound sense of hopelessness and weariness, reflecting the passage of time and the weight of existence.",The Book of Human Emotions
Grief,A profound sense of loss and sorrow over the absence of someone deeply admired or loved.,The Book of Human Emotions
Not specified,"The text does not explicitly describe an emotion but references Georges Bataille's philosophical work on eroticism, taboo, and their connections to death and sensuality.",The Book of Human Emotions
Not explicitly stated,"The text does not directly describe an emotion but references a scientific study on human sexual response by Masters and Johnson, focusing on physiological and psychological aspects of sexuality.",The Book of Human Emotions
Despair,"A profound sense of hopelessness and loss, often accompanied by feelings of defeat and an inability to see a way forward.",The Book of Human Emotions
Existential despair,"A profound fear or anxiety about losing one’s sense of self, rooted in existential concerns about identity and purpose.",The Book of Human Emotions
Contentment,"A state of eternal rest and blissful ease, reflecting a profound sense of peace and happiness.",The Book of Human Emotions
Acceptance,"The text reflects a sense of acceptance and resilience, symbolized by the man continuing his task despite its futility, embodying a philosophical embrace of life's struggles.",The Book of Human Emotions
Desire to disappear,"A longing to vanish or escape from existence, often driven by feelings of overwhelm, shame, or a need for relief from emotional or social pressures.",The Book of Human Emotions
Regret,"The desire to erase past actions or events, reflecting a longing to undo mistakes or escape their consequences.",The Book of Human Emotions
Disappointment,A feeling of sadness or dissatisfaction caused by unmet expectations or outcomes falling short of hopes.,The Book of Human Emotions
Pleasure,"A sense of satisfaction or enjoyment, expressed through deliberate and composed actions, such as trotting gravely.",The Book of Human Emotions
Confusion,"The phrase ""double insanity"" suggests a complex or perplexing emotional state, potentially reflecting confusion or disbelief regarding the defense argument in Mary Harris's trial.",The Book of Human Emotions
Curiosity,"The text reflects intellectual curiosity, referencing Freud's concept of ""family romance"" and its exploration in psychological works, indicating an interest in understanding complex familial and psychological dynamics.",The Book of Human Emotions
Loneliness,A profound sense of isolation stemming from the belief that no ideal or complete version of oneself exists.,The Book of Human Emotions
Betrayal,"A feeling of treachery, indicating a profound sense of disloyalty or deceit.",The Book of Human Emotions
Disgruntlement,"A feeling of dissatisfaction or annoyance, often due to unmet expectations or perceived unfairness.",The Book of Human Emotions
Disgruntled,"A state of dissatisfaction or annoyance, often expressed through a lack of enthusiasm or displeasure with circumstances.",The Book of Human Emotions
Vengeance,"Raoul Silva exhibits a deep desire for revenge against MI6, driven by betrayal and personal suffering, which fuels his calculated and destructive actions in the film Skyfall.",The Book of Human Emotions
Gratitude,"Expresses thankfulness and optimism, emphasizing progress and forward momentum as part of a collective spirit.",The Book of Human Emotions
Adaptability,"The capacity to adjust, reconfigure, and remain flexible in response to changing circumstances, as discussed by Paolo Virno in Sianne Ngai's *Ugly Feelings*.",The Book of Human Emotions
Concern,"The text reflects concern over corporate reliance on cybersecurity consultants to address insider threats, referencing behavioral risk indicators and intellectual property theft.",The Book of Human Emotions
Despondence and grumpiness,"A state of low spirits and irritability, reflecting a sense of hopelessness and dissatisfaction.",The Book of Human Emotions
Disgust,"A strong feeling of aversion or repulsion, often triggered by something offensive, unpleasant, or morally unacceptable.",The Book of Human Emotions
Universal basic emotions,"Universal basic emotions are fundamental feelings shared across humans, influenced by both biological and cultural factors, as discussed by Paul Ekman in his work on body and facial movements.",The Book of Human Emotions
Disgust,"Disgust is a complex emotion explored through various perspectives, including its meaning and anatomy, as analyzed by authors Colin McGinn and William Ian Miller in their respective works.",The Book of Human Emotions
Disgust,"Disgust arises from perceiving something as impure or out of its proper context, reflecting societal notions of cleanliness and order.",The Book of Human Emotions
Disgust,"Disgust, as explored through historical research by Richard Firth-Godbehere, was not a term used by early moderns but has since been studied in the context of emotions' history.",The Book of Human Emotions
Disgust,"Disgust is explored through the concept of sympathetic magic, highlighting how people associate contamination or uncleanliness with certain objects or actions, influencing their emotional and psychological reactions.",The Book of Human Emotions
Dismay,"A feeling of distress or disappointment, often caused by an unexpected or unfavorable outcome.",The Book of Human Emotions
Horror and dismay,"Mr. Pickwick experiences intense shock and distress, nearly fainting due to overwhelming negative emotions.",The Book of Human Emotions
Despair,"The character feels an overwhelming sense of hopelessness and perceives himself as lifeless or doomed, reflecting profound emotional anguish.",The Book of Human Emotions
Overwhelm,"Stendhal Syndrome describes being emotionally overwhelmed by exposure to art or beauty, leading to intense feelings such as dizziness, confusion, or even physical symptoms.",The Book of Human Emotions
Dread,"A deep sense of fear or apprehension about an anticipated event or outcome, often accompanied by a feeling of impending doom.",The Book of Human Emotions
Rootlessness,"A sense of being disconnected, lacking stability or belonging, likened to a phantom without roots or foundation.",The Book of Human Emotions
Uncertainty,The text conveys uncertainty due to conflicting reports and differing estimates regarding the number of deaths caused by disease.,The Book of Human Emotions
Fear,"The text conveys fear as it recounts the devastating impact of the plague, highlighting the widespread dread and anxiety experienced during the outbreaks.",The Book of Human Emotions
Ecstasy,"A state of intense happiness, overwhelming joy, and delight, often accompanied by a sense of euphoria and transcendence.",The Book of Human Emotions
Pain,"Overwhelming physical or emotional suffering expressed through a loud scream, indicating intense distress.",The Book of Human Emotions
Spiritual ecstasy,"A profound state of spiritual elation and transcendence, characterized by a deep connection to the divine or mystical experience, as referenced in Rumi's poetic expression.",The Book of Human Emotions
Ecstasy,"A state of intense emotional or spiritual exaltation, often depicted in a passionate or transcendent posture, as documented in the photographic study ""Extase 1878"" from the Iconographie Photographique de la Salpêtrière.",The Book of Human Emotions
Indifference,"The statement reflects a sense of detachment or lack of concern, questioning the significance of labeling something as a disease.",The Book of Human Emotions
Embarrassment,"A self-conscious emotion arising from a perceived mistake, awkward situation, or social misstep, often accompanied by discomfort, blushing, or a desire to hide.",The Book of Human Emotions
Embarrassment,"A social emotion arising from self-consciousness, often triggered by a perceived failure to meet social expectations or norms, as explored by sociologist Erving Goffman in his analysis of its role in social organization.",The Book of Human Emotions
Unclear,The text does not provide any specific emotion or emotional context for analysis.,The Book of Human Emotions
Embarrassment,"A social emotion arising from self-awareness and concern about others' perceptions, often linked to conformity and maintaining social norms.",The Book of Human Emotions
Indignation,A feeling of anger or annoyance provoked by perceived unfair treatment or injustice.,The Book of Human Emotions
Blushing,"A physiological response characterized by redness of the face, often triggered by feelings of embarrassment, shame, or modesty, as explored in Thomas Henry Burgess's work on the mechanism of blushing.",The Book of Human Emotions
Not explicitly stated,"The text does not directly describe an emotion but references a historical work by Charles Darwin on emotional expression, specifically mentioning a ""servant Negress"" in a context that may involve observation of emotions or behaviors.",The Book of Human Emotions
Embarrassment,"The text suggests that embarrassment causes blood to rush to the skin's surface, likely resulting in visible blushing.",The Book of Human Emotions
Empathy,"The ability to understand and share the feelings of others, often involving compassion and emotional connection.",The Book of Human Emotions
Aesthetic appreciation,"Vernon Lee explored the psychological experience of beauty and ugliness, emphasizing the emotional and intellectual responses to aesthetics in her collaborative work with C. Anstruther-Thomson.",The Book of Human Emotions
Empathy,"Empathy is described as a ""universal solvent,"" highlighting its transformative power in understanding and mitigating human cruelty, as discussed in Simon Baron-Cohen's work.",The Book of Human Emotions
Curiosity,"The text conveys intellectual curiosity and fascination with the potential impact of mirror neurons on psychology and human evolution, as discussed by Vilayanur Ramachandran.",The Book of Human Emotions
Fear,"The passage describes the instinctive fear and anticipation of pain when witnessing a potentially harmful action, even if it does not directly affect us.",The Book of Human Emotions
Hostility,"Hobbes describes human nature as inclined toward aggression and destruction, emphasizing a tendency for conflict and invasion.",The Book of Human Emotions
Sympathy,"Sympathy, as explored in the eighteenth century, reflects an interest in understanding and sharing the feelings of others, emphasizing human connection and kindness, as discussed by Taylor and Phillips in ""On Kindness.""",The Book of Human Emotions
Compassion,"Feeling deep sorrow and shedding tears for the suffering or misfortune of others, as described in the context of moral sensitivity and empathy.",The Book of Human Emotions
Envy,"A feeling of discontent or resentment aroused by someone else's possessions, qualities, or achievements, often accompanied by a desire to have the same.",The Book of Human Emotions
Desperation,"The phrase conveys a sense of extreme poverty or lack, evoking feelings of helplessness and destitution.",The Book of Human Emotions
Jealousy,"A fundamental human emotion explored by Nancy Friday, highlighting its pervasive presence in all aspects of life.",The Book of Human Emotions
Envy,"A destructive impulse driven by dissatisfaction, leading to a desire to take away or spoil what another possesses.",The Book of Human Emotions
Unclear,The text does not explicitly describe an emotion but references Fredric Jameson's work on narrative and its social symbolism.,The Book of Human Emotions
Euphoria,"An intense feeling of happiness, excitement, or well-being, often overwhelming and associated with moments of great joy or achievement.",The Book of Human Emotions
Pride,"The text reflects pride in Lina Ben Mhenni's activism and blogging efforts, highlighting her impactful role as a Tunisian activist and her influential blog, ""A Tunisian Girl.""",The Book of Human Emotions
Curiosity,"The text conveys an inquisitive interest in uncovering the hidden aspects of opium, reflecting a desire to explore and reveal its mysteries.",The Book of Human Emotions
Cheerfulness,"A lighthearted and playful state of happiness, referred to as ""silly cheerfulness,"" characterized by an upbeat and carefree demeanor.",The Book of Human Emotions
Affective symptomatology,"The text explores emotional disturbances associated with disseminated sclerosis, as studied by physicians Cottrell and Wilson in 1926, highlighting the interplay between neurological conditions and emotional symptoms.",The Book of Human Emotions
Not provided,The text does not describe an emotion or provide any emotional context. It references a study on neuropsychiatric manifestations of multiple sclerosis.,The Book of Human Emotions
Aliveness,"Wilko Johnson expresses a profound sense of being alive and invigorated despite facing terminal cancer, highlighting an unexpected emotional awakening in the face of mortality.",The Book of Human Emotions
Excitement,"A feeling of enthusiasm and eagerness, often accompanied by heightened energy and anticipation for something positive or thrilling.",The Book of Human Emotions
Affection,"The text describes affectionate behavior through actions like laughing, talking, and kissing, emphasizing positive social and emotional connection.",The Book of Human Emotions
Excitement,"Excitement is described as an ""emotion of action,"" emphasizing its role in driving activity and engagement.",The Book of Human Emotions
Excitement,"Excitement is linked to the physiological effects of adrenaline, highlighting its role as a key factor in the experience of heightened emotional arousal and stimulation.",The Book of Human Emotions
Excitement,"The text conveys a sense of excitement and stimulation, emphasizing the need for heightened physical or emotional arousal.",The Book of Human Emotions
Fago,"A complex emotion from the Ifaluk culture, combining love, compassion, and sadness, often felt in response to suffering or the need for care in others.",The Book of Human Emotions
Implicit poetry,"A nuanced and culturally embedded sentiment observed in Ifaluk, reflecting the unique emotional expressions and perspectives within the Micronesian Atoll's societal context.",The Book of Human Emotions
Fear,"An emotional response to a perceived threat or danger, often triggering a fight, flight, or freeze reaction.",The Book of Human Emotions
Fear,"Fear is described as a fundamental and ancient emotion, recognized and expressed by humans and animals from very early periods in history.",The Book of Human Emotions
