Emotion,Description,Source
Pride,"Pride is a wave-like feeling of fullness and accomplishment, often arising from overcoming challenges or recognition. It contrasts with shame, as pride encourages visibility and self-acknowledgment, making one's inner self feel vibrant and complete.",The Book of Human Emotions
Pride,"Pride, both true and false, can blind individuals to their limitations, foster defensiveness, and hinder self-awareness. False pride, in particular, resists vulnerability, refuses help, and avoids acknowledging flaws, as seen in the narrator of Munro’s story, whose pride prevents him from addressing a personal insecurity despite recognizing its validity.",The Book of Human Emotions
Pride,"Soyinka's reaction to the Benin Bronzes reflects pride in African cultural achievements, countering colonial narratives of inferiority. This pride emerges from recognizing both the loss caused by colonialism and the greatness of African civilizations, fostering a sense of restored identity and self-esteem.",The Book of Human Emotions
Contentment,"A state of satisfaction and ease, often linked to self-esteem and a sense of fulfillment.",The Book of Human Emotions
Pronoia,"The belief or feeling that the universe is conspiring in your favor, fostering a sense of optimism and trust in positive outcomes.",The Book of Human Emotions
Paranoia,"A peculiar sensation of mistrust, feeling as though others' assistance may have hidden motives.",The Book of Human Emotions
Gratitude,"A feeling of thankfulness and appreciation, often directed towards others or circumstances.",The Book of Human Emotions
Rage,"Intense, uncontrollable anger often accompanied by a strong desire to act or retaliate.",The Book of Human Emotions
Rage,"Rage is an uncontrollable, irrational frenzy marked by physical outbursts like flailing and shouting. Unlike concealed emotions such as jealousy, it erupts in bursts and cannot be hidden. While anger and indignation can be justified, rage lacks rationality.",The Book of Human Emotions
Rage,"The text explores the proliferation of rage types, from road rage to wrap rage, highlighting society's complex and uneasy relationship with uncontrollable fury, which contrasts with the lack of similar categorization for other emotions like homesickness or doubt. Rage both fascinates and terrifies due to its unpredictable nature.",The Book of Human Emotions
Rage,"Rage is increasingly scrutinized in modern society, with impulsive, disproportionate outbursts now classified as intermittent explosive disorder. This condition involves sudden loss of control, causing harm or damage, and is linked to low serotonin levels, with antidepressants suggested as treatment. Social norms in Britain and America deem such anger increasingly unacceptable.",The Book of Human Emotions
Rage,"Rage is a natural, intense response to perceived injustice, tied to a sense of defiance and the potential for societal change. Suppressing it risks dehumanizing individuals and removing a catalyst for justice and transformation.",The Book of Human Emotions
Frustration,"Frustration arises from minor irritations, such as unmet expectations or repeated annoyances, leading to brief outbursts of anger. While often regretted, these moments reflect human engagement with the world and can connect to larger expressions of dissatisfaction, like revolutions or riots.",The Book of Human Emotions
Exasperation,"A feeling of intense irritation or frustration, often due to repeated or prolonged annoyance.",The Book of Human Emotions
Regret,"A feeling of sorrow or disappointment over something that has happened or been done, often due to a perceived mistake or missed opportunity.",The Book of Human Emotions
Regret,"Regret is a seductive emotion that intertwines discomfort with fleeting pleasure and relief. It entices through ""what if"" fantasies, offering temporary solace by imagining alternative outcomes or reversed decisions, despite its association with stagnation.",The Book of Human Emotions
Regret,"Regret, originating from Old French, initially described grief over loss and was expressed through public lamentations. By the 16th century, it evolved into a private, self-reproaching anguish over past actions, becoming a moral deterrent tied to internalized guilt rather than external punishment.",The Book of Human Emotions
Regret,"Regret is a private emotion tied to loss and self-perception. It arises when actions conflict with one’s identity, often rooted in past criticisms or failures. It’s painful when efforts to counter negative beliefs are undermined, intertwining regret with disappointment over lost self-assigned roles or aspirations.",The Book of Human Emotions
Regret,"Regret, often seen as pointless, can foster personal growth by encouraging responsibility, learning from mistakes, and understanding self-beliefs. It highlights human ambivalence and the impossibility of predicting outcomes, ultimately helping build resilience and a flexible self-view.",The Book of Human Emotions
Regret,"Regret is a yearning for a different outcome, marked by mental wavering and persistent discomfort. Unlike resignation, it holds a peculiar hope by allowing us to imagine alternate possibilities and learn from past experiences.",The Book of Human Emotions
Melancholy/Nostalgia,"A reflective and often bittersweet emotional state, evoking a sense of longing or sadness for the past or something lost.",The Book of Human Emotions
Relief,"A feeling of reassurance and relaxation following the removal or reduction of stress, pain, or discomfort.",The Book of Human Emotions
Vulnerability,"The speaker expresses a need to release emotions, seeking permission to cry, indicating openness and emotional sensitivity.",The Book of Human Emotions
Melancholy,"Helena, slightly drunk and sentimental, reflects on aging, her children's struggles, and the passage of time during a quiet, late-night moment, expressing a desire to cry.",The Book of Human Emotions
Frustrated sadness,"A woman struggles to cry despite emotional distress, attempting to force tears through physical gestures, but remains unable to release her emotions, reflecting frustration and sadness.",The Book of Human Emotions
Emotional numbness,"The speaker feels unable to cry or express their emotions, seeking solace in alcohol to cope.",The Book of Human Emotions
Relief,"She finds relief through laughter at her own absurdity after drinking, providing the emotional release she seeks.",The Book of Human Emotions
Grief,"The scene reflects the idea that crying provides relief, as grief is expressed and alleviated through tears, echoing Ovid's sentiment about the cathartic nature of weeping.",The Book of Human Emotions
Relief,"Relief is a pleasure felt when actual or anticipated pain subsides, either through bodily sensations (e.g., sneezing, orgasm) or near-miss experiences (e.g., finding lost keys). The latter is a ""prospect-based emotion,"" involving comparisons of alternative realities and tied to satisfaction and disappointment.",The Book of Human Emotions
Relief,"Crying can bring relief and emotional refreshment, acting as a physical release of tension. While theories suggest tears may flush out toxins or hormones, the true impact appears more psychological than physiological, akin to catharsis. This emotional release has been recognized since ancient times, symbolizing renewal and inner calm.",The Book of Human Emotions
Relief,"Relief is a complex emotion that often intertwines with other feelings like adrenaline, disappointment, or solace. It arises from unburdening oneself, being understood, or receiving support, offering a sense of lightness and reassurance, not merely from venting but from feeling seen and acknowledged.",The Book of Human Emotions
Empathy,"The text associates weeping with empathy, suggesting a connection between emotional expression and understanding or sharing the feelings of others.",The Book of Human Emotions
Grief,"A deep sorrow often caused by loss, such as the death of a loved one, leading to emotional pain and mourning.",The Book of Human Emotions
Reluctance,"A feeling of hesitation or unwillingness to act, often due to doubt, fear, or lack of desire.",The Book of Human Emotions
Pressure,"The text conveys a sense of societal pressure to make commitments, emphasizing decisiveness and clarity as expectations promoted by external sources like magazines and self-help books.",The Book of Human Emotions
Reluctance,"A hesitant, noncommittal feeling marked by resistance to action, such as delaying decisions or avoiding tasks.",The Book of Human Emotions
Ambivalence,"Amelia Earhart felt conflicted on her wedding day, torn between societal expectations of being a dutiful wife and her desire for independence and passion for flying, a struggle she had repeatedly discussed with her partner.",The Book of Human Emotions
Pragmatic love,"The text conveys a pragmatic and forward-thinking approach to love, emphasizing mutual understanding, freedom, and realistic expectations within a happy marriage. Despite her untimely death, the marriage remained intact, reflecting a balance of affection and practicality.",The Book of Human Emotions
Ambivalence,"A state of mixed or conflicting feelings, often linked to uncertainty and indecision, offering potential benefits in certain contexts.",The Book of Human Emotions
Remorse,"A deep sense of regret or guilt for a past action, often accompanied by a desire to make amends or undo the harm caused.",The Book of Human Emotions
Remorse,"Overwhelmed by guilt after harming his mother, the young man expresses deep remorse through self-punishment, as depicted in a 1450s painting where Saint Peter attempts to heal him while anxious women look on.",The Book of Human Emotions
Remorse,"A painful yet urgent emotion driven by the realization of having hurt someone, remorse compels action to make amends. Unlike shame or regret, it is wild, tinged with terror and love, and rooted in a hopeful desire to heal and preserve relationships.",The Book of Human Emotions
Remorse,"Remorse is highlighted in today's ""Age of Apology,"" where public displays of contrition by figures like politicians and celebrities aim to aid victims' healing and satisfy societal demands for accountability following scandals or past wrongdoings.",The Book of Human Emotions
Remorse,"Remorse is questioned for its sincerity due to its performative nature, often taught as a learned behavior. It’s debated whether remorse is genuine or strategic, as seen in political apologies or legal processes, and whether it qualifies as a true emotion or merely a social construct.",The Book of Human Emotions
Remorse,"A deeply passionate and sorrowful emotion, often expressed through tears, self-abasement, and physical acts of contrition. In medieval Europe, remorse was central to religious devotion, legal processes, and public penance, serving as evidence of sincere repentance and often influencing judgments of mercy.",The Book of Human Emotions
Remorse,"Medieval theologians viewed true remorse as a rational, voluntary spiritual virtue involving a calm, reasoned desire to make amends, rejecting excessive emotional displays or extreme acts of penitence, which they believed could lead to disproportionate harm rather than genuine atonement.",The Book of Human Emotions
Remorse,"Remorse is portrayed as a thoughtful and restrained emotion, calculated in a quiet manner rather than impulsively, prompting reflection on its authenticity in public displays.",The Book of Human Emotions
Guilt,"A feeling of responsibility or remorse for a perceived wrongdoing or failure, often accompanied by self-reproach or regret.",The Book of Human Emotions
Reproachfulness,A feeling of disapproval or disappointment directed toward someone due to their actions or behavior.,The Book of Human Emotions
Smugness,"A sense of self-righteous satisfaction derived from confronting or correcting others' inappropriate behavior, such as addressing racism or discourtesy.",The Book of Human Emotions
Regret,"The hesitation and premonition of regret when correcting others, leading to restrained expressions of disapproval like cold looks, sighs, or mutterings due to fear of misunderstanding or hurting feelings.",The Book of Human Emotions
Irritation,"Frustration arises when efforts to address issues are ignored or met with defensive reproaches, highlighting the irritation caused by others' unwillingness to accept criticism or judgment.",The Book of Human Emotions
Fury,"The text conveys intense, unexpressed anger, manifesting as inner rage, a critical mindset, and suppressed irritation while navigating the city.",The Book of Human Emotions
Miffed,A mild feeling of annoyance or irritation.,The Book of Human Emotions
Resentment,A feeling of bitterness or indignation arising from perceived unfair treatment or being wronged.,The Book of Human Emotions
Resentment,"Resentment arises from suppressed anger and hatred due to unexpressed hurt, humiliation, or frustration. It stems from dependency and manifests over time as compacted bitterness, expressed subtly through spiteful, competitive, or punishing actions.",The Book of Human Emotions
Resentment,A quiet yet deeply unpleasant and negative emotion.,The Book of Human Emotions
Resentment,"Resentment is a voiceless feeling rooted in bitterness and unsatisfied vengefulness, historically linked to physical and emotional decay. In art, it was depicted as pale, thin, and ulcerous, symbolizing retained anger as a corrosive force harming both the soul and body.",The Book of Human Emotions
Resentment,"Resentment is linked to physical health issues, such as digestive problems, according to 1950s psychosomatic medicine. It suggests that releasing buried anger in a safe therapeutic setting can prevent its harmful effects, an idea that continues to influence perspectives on emotional health.",The Book of Human Emotions
Resentment,"Resentment is a bitter, suppressed emotion associated with seething frustration and a sense of injustice. It is often harbored secretly by individuals who avoid confrontation, deriving a perverse satisfaction from feeling wronged while resisting resolution.",The Book of Human Emotions
Resentment,"Resentment, or ressentiment, is described as a suppressed and petty emotion stemming from powerlessness, where individuals bury their indignation and vengeful urges, occasionally expressing them in minor acts of spite. Nietzsche contrasts this with a noble ""master morality"" that once celebrated direct rage and vengeance, which was replaced by a ""slave morality.""",The Book of Human Emotions
Ressentiment,"Ressentiment is a hidden anger and denial focused on compensation rather than action. Nietzsche linked it to religious teachings of patient suffering and redress, while Žižek controversially associates it with terrorism, framing it as a morally suspect, low-status response rather than heroic emotions like rage or revenge.",The Book of Human Emotions
Resentment,"Resentment is a settled, deliberate emotion often arising from suppressed anger. It can act as a restraint in escalating situations and is shaped by prolonged suffering, fantasies of revenge, and disappointment. Cultures with histories of oppression may view it as a distinct emotional experience, influencing deep emotional and psychological development.",The Book of Human Emotions
Anger,"A strong feeling of displeasure or hostility, often in response to perceived wrongs or frustrations.",The Book of Human Emotions
Ringxiety,"The phantom sensation of feeling or hearing a phone ring or vibrate when it hasn't, often linked to anxiety or habitual phone use.",The Book of Human Emotions
Ringxiety,"A low-level anxiety where one falsely perceives their phone ringing or vibrating, reflecting a heightened state of readiness for communication in the modern age.",The Book of Human Emotions
Anticipation/Dread,"A state of expectation or apprehension, often involving a mix of excitement or fear about future events.",The Book of Human Emotions
Rivalry,"A competitive feeling or tension arising from a desire to outperform or surpass someone else, often accompanied by comparison and ambition.",The Book of Human Emotions
Jealousy,"Overwhelmed by frustration and envy toward a relative who effortlessly outshines you, stealing attention and success. This leads to anger, self-doubt, and a desperate need to compete, culminating in feelings of inadequacy and resentment.",The Book of Human Emotions
Rivalry,"The text explores rivalry as a fundamental human emotion, tied to possessiveness, jealousy, and competition. Philosophers like Hobbes and Spencer emphasized life as a competitive struggle, though Darwin highlighted compassion and altruism as equally vital for survival.",The Book of Human Emotions
Sibling rivalry,"A natural instinct characterized by competitiveness and jealousy among siblings, rooted in survival instincts and historically acknowledged, with the term coined in 1893 by child psychologists.",The Book of Human Emotions
Envy,"In the early 20th century, concerns about sibling rivalry and envy grew, fueled by fears of family breakdown. Smaller families highlighted unequal resource distribution, and competition was seen as emotionally damaging, as depicted in Arthur Miller's ""Death of a Salesman,"" where rivalry and despair dominate familial relationships.",The Book of Human Emotions
Rivalry,"Rivalry is framed as a potentially positive force, fostering creativity, motivation, flexibility, and emotional intelligence in children as they navigate and understand the impact of their actions on others.",The Book of Human Emotions
Ambition,"Montaigne reflects on ambition, highlighting its dual nature—testing strategic thinking and virtues like courage, while exposing individuals to intense emotions such as jealousy, triumph, anger, and vengefulness. He contrasts true effort with ease, emphasizing the depth of living through challenges rather than passivity.",The Book of Human Emotions
Disillusionment,"The text conveys a sense of disillusionment, highlighting the paradox that achieving success or reaching the top can lead to a dull and unsatisfying life.",The Book of Human Emotions
Smugness,"A feeling of self-satisfaction or superiority, often accompanied by a sense of pride or conceit.",The Book of Human Emotions
Anger,"Intense anger or frustration experienced while driving, often triggered by traffic, other drivers' actions, or delays.",The Book of Human Emotions
Indignation,"Drivers felt indignation when others disrespected road rules, leading to retaliatory actions like cutting off vehicles, ramming, or confronting others aggressively.",The Book of Human Emotions
Rage,"Intense anger experienced during driving, often leading to violent or aggressive behavior, recognized as a road hazard since the late 1980s.",The Book of Human Emotions
Aggression,"Aggression arises from disinhibition while driving, as cars create a sense of anonymity and detachment. This lack of eye contact and emotional cues fosters hostility, unlike face-to-face interactions where gestures and eye contact can diffuse indignation.",The Book of Human Emotions
Conscientiousness,"The presence of eye images triggers a sense of being observed, leading to more generous, responsible, and prosocial behavior, as shown in experiments involving honesty boxes, recycling bins, and charitable websites.",The Book of Human Emotions
Insulted,"A feeling of being disrespected or offended, often accompanied by paranoia or rage.",The Book of Human Emotions
Ruinenlust,"A fascination or yearning for ruins, often evoking a mix of nostalgia, curiosity, and aesthetic appreciation for decay and history.",The Book of Human Emotions
Fascination,A strong attraction to the mystery and decay of abandoned places and crumbling buildings.,The Book of Human Emotions
Morbid Curiosity,"A fascination with macabre, unsettling, or tragic subjects, often driven by a desire to understand or confront darker aspects of life.",The Book of Human Emotions
Sadness,"A feeling of sorrow or unhappiness often caused by loss, disappointment, or difficult circumstances.",The Book of Human Emotions
Alarm,A sudden sense of fear or urgency triggered by being informed of a terrible event.,The Book of Human Emotions
Sadness,"A deep, exhausted feeling tied to loss and resignation, often silencing or prompting consolation through talking and tears. It arises when facing the irreversible, marking acceptance of what cannot be changed.",The Book of Human Emotions
Sadness,"Sadness, historically linked to being ""sated"" or having one's fill, was seen as an excess rather than a lowered emotional state, often bordering on boredom, as reflected in early literary depictions like the Exeter Book.",The Book of Human Emotions
Sadness,"In the Renaissance, sadness was linked to physical heaviness caused by black bile, making one clumsy and slow. However, it was also seen as a virtue, symbolizing sobriety and humility. Protestant theologians valued ""godly sorrow,"" a grief tied to recognizing spiritual failings and fostering humility before God.",The Book of Human Emotions
Sadness,"Sadness was seen as emotional training, fostering resilience. Early moderns, like Thomas Elyot in 1539, encouraged understanding others' sorrow to better handle personal sadness, viewing it as protection against severe conditions like melancholia or despair.",The Book of Human Emotions
Sadness,"The text explores the concept of sadness, emphasizing the need to understand and endure it. It critiques the overdiagnosis of depression, arguing that some cases labeled as depression are actually sadness, driven by inadequate diagnostic criteria in the DSM, leading to an ""epidemic"" of misdiagnosed depression.",The Book of Human Emotions
Sadness,"The text critiques the medicalization of sadness, highlighting how the DSM's evolving criteria for depression blur the line between natural emotional responses and clinical disorders, erasing distinctions like grief or situational sadness. This shift influences public understanding, promotes self-diagnosis, and diminishes acceptance of sadness as a natural part of life.",The Book of Human Emotions
Sadness,"Sadness is portrayed as a natural, enriching emotion often suppressed or misdiagnosed as depression. Overreliance on antidepressants and societal stigma can hinder emotional growth, maturity, and the ability to process adverse experiences, potentially worsening the feeling when it is repressed.",The Book of Human Emotions
Sadness,"Sadness, distinct from depression, involves satiety, acceptance, and even apathy. It helps us adjust to loss or disappointment, offering rest and strength. Embracing it fosters resilience, while rejecting it increases vulnerability to its more severe forms.",The Book of Human Emotions
Grief,"A deep emotional response to loss, often involving sadness, pain, and mourning.",The Book of Human Emotions
Satisfaction,"A feeling of contentment or fulfillment arising from achieving a goal, meeting expectations, or experiencing something pleasurable or rewarding.",The Book of Human Emotions
Satisfaction,"Rizzo feels gleeful and self-satisfied after orchestrating a confrontation between Sandy and Danny, relishing her revenge with a sparkling, contemptuous smile.",The Book of Human Emotions
Satisfaction,"Satisfaction is expressed through various smiles, ranging from triumph and contentment to smugness or irony. These smiles, like the wry ""il sorriso di chi la sa lunga,"" reflect knowingness or accomplishment. They gained particular cultural prominence in 18th-century France, where Parisians embraced smiling briefly.",The Book of Human Emotions
Contentment,"Enlightenment philosophers embraced a sense of satisfaction and interior contentedness, symbolized by a confident, curious smile. They viewed this emotional state as ideal for engaging with the world, reflecting liberation, self-actualization, and happiness in an era of scientific and secular progress.",The Book of Human Emotions
Satisfaction,"Satisfaction, historically tied to fulfilling obligations or penance, evolved to describe a feeling of contentment from effectively using one’s skills. Enlightenment thinkers viewed it as a “secret joy” and linked discontent to unutilized abilities, foreshadowing modern concepts like job satisfaction.",The Book of Human Emotions
Smugness,"In the 1780s, French aristocrats adopted smiles as symbols of progressiveness and wealth, reflecting self-satisfaction due to advances in dentistry. However, this smugness was short-lived, as the violent upheavals of the French Revolution replaced smiles with screams in depictions of Parisians by 1792.",The Book of Human Emotions
Cheerfulness,"The text highlights America's cultural celebration of cheerfulness, symbolized by smiling figures in advertisements and media. It connects improved dentistry, societal ideals, and sexual satisfaction to the portrayal of cheerful smiles, exemplified by Sandy's confident, enviable smile in the original Grease poster.",The Book of Human Emotions
Smugness,"A feeling of self-satisfaction or superiority, often accompanied by an air of conceit or complacency.",The Book of Human Emotions
Saudade,"A deep emotional state of nostalgic longing for something or someone absent, often with bittersweet feelings of love and melancholy.",The Book of Human Emotions
Saudade,"A deep emotional state of longing and nostalgia, originating in Portugal, for absent loved ones, distant places, or lost times, often with a mix of sadness and fondness. It emerged during the Age of Discovery, reflecting the ache for those separated by voyages.",The Book of Human Emotions
